{
  "id": "ko/grapheme-to-phoneme.data",
  "kind": "grapheme_to_phoneme",
  "source": "WIKIPRON",
  "derived_by": "dataset",
  "confidence": "high",
  "data": {
    "count": 36146,
    "byScript": {
      "kor_hang_narrow_filtered": {
        "count": 36146,
        "sample": [
          [
            "ᆜ",
            "j ɯ"
          ],
          [
            "ㄱㄱ",
            "k o̞ ɡ o̞"
          ],
          [
            "ㄴㄴ",
            "n o̞ n o̞"
          ],
          [
            "ㄹ혜",
            "k ɯ n ɦ e̞"
          ],
          [
            "ㄹ혜",
            "k ɯ n ʝ e̞"
          ],
          [
            "ㄹ혜",
            "ɾ i ɯ ɾ ɦ e̞"
          ],
          [
            "ㄹ혜",
            "ɾ i ɯ ɾ ʝ e̞"
          ],
          [
            "ㅅㄲ",
            "sʰ e̞ k͈ i"
          ],
          [
            "ㅇㅇ",
            "ɯ ŋ"
          ],
          [
            "ㅈㅅ",
            "t͡ɕ w e̞ sʰ o̞ ŋ"
          ],
          [
            "ㅊㅋ",
            "t͡ɕʰ kʰ"
          ],
          [
            "ㅋㅋㅋ",
            "k x ɯ k x ɯ k x ɯ"
          ],
          [
            "ㅏ",
            "a̠"
          ],
          [
            "ㅐ",
            "e̞"
          ],
          [
            "ㅑ",
            "j a̠"
          ],
          [
            "ㅓ",
            "ʌ̹"
          ],
          [
            "ㅔ",
            "e̞"
          ],
          [
            "ㅕ",
            "j ʌ̹"
          ],
          [
            "ㅖ",
            "j e̞"
          ],
          [
            "ㅗ",
            "o̞"
          ],
          [
            "ㅘ",
            "w a̠"
          ],
          [
            "ㅚ",
            "w e̞"
          ],
          [
            "ㅛ",
            "j o"
          ],
          [
            "ㅜ",
            "u"
          ],
          [
            "ㅝ",
            "w ʌ̹"
          ],
          [
            "ㅞ",
            "w e̞"
          ],
          [
            "ㅟ",
            "ɥ i"
          ],
          [
            "ㅠ",
            "j u"
          ],
          [
            "ㅡ",
            "ɯ"
          ],
          [
            "ㅢ",
            "ɰ i"
          ],
          [
            "ㅣ",
            "i"
          ],
          [
            "ㆉ",
            "j o j"
          ],
          [
            "ㆌ",
            "j u j"
          ],
          [
            "가",
            "k a̠"
          ],
          [
            "가",
            "k a̠ː"
          ],
          [
            "가가대소",
            "k a̠ ɡ a̠ d e̞ sʰ o̞"
          ],
          [
            "가가린",
            "k a̠ ɡ a̠ ɾ i n"
          ],
          [
            "가가우스어",
            "k a̠ ɡ a̠ u sʰ ɯ ʌ̹"
          ],
          [
            "가감",
            "k a̠ ɡ a̠ m"
          ],
          [
            "가감하다",
            "k a̠ ɡ a̠ m ɦ a̠ d a̠"
          ],
          [
            "가강수량",
            "k a̠ ɡ a̠ ŋ sʰ u ɾ j a̠ ŋ"
          ],
          [
            "가갸시절",
            "k a̠ ɡ j a̠ ɕʰ i d͡ʑ ʌ̹ ɭ"
          ],
          [
            "가갸표",
            "k a̠ ɡ j a̠ pʰ j o"
          ],
          [
            "가게",
            "k a̠ ɡ e̞"
          ],
          [
            "가게",
            "k a̠ː ɡ e̞"
          ],
          [
            "가겟방",
            "k a̠ ɡ e̞ t̚ p͈ a̠ ŋ"
          ],
          [
            "가격",
            "k a̠ ɡ j ʌ̹ k̚"
          ],
          [
            "가격대",
            "k a̠ ɡ j ʌ̹ k̚ t͈ e̞"
          ],
          [
            "가격표",
            "k a̠ ɡ j ʌ̹ k̚ pʰ j o"
          ],
          [
            "가계",
            "k a̠ ɡ e̞"
          ]
        ],
        "url": "https://raw.githubusercontent.com/CUNY-CL/wikipron/master/data/scrape/tsv/kor_hang_narrow_filtered.tsv"
      }
    }
  }
}
