{
  "id": "uk/grapheme-to-phoneme.data",
  "kind": "grapheme_to_phoneme",
  "source": "WIKIPRON",
  "derived_by": "dataset",
  "confidence": "high",
  "data": {
    "count": 53021,
    "byScript": {
      "ukr_cyrl_narrow": {
        "count": 53021,
        "sample": [
          [
            "Є",
            "j ɛ"
          ],
          [
            "Єбларусь",
            "j e b ɫ ɐ r u sʲ"
          ],
          [
            "Єва",
            "j ɛ ʋ ɐ"
          ],
          [
            "Євангеліє",
            "j e ʋ a n ɦ e lʲ i j e"
          ],
          [
            "Євген",
            "j e u̯ ɦ ɛ n"
          ],
          [
            "Євгененко",
            "j e u̯ ɦ e n ɛ n k ɔ"
          ],
          [
            "Євгенович",
            "j e u̯ ɦ ɛ n ɔ ʋ e t͡ʃ"
          ],
          [
            "Євгенівна",
            "j e u̯ ɦ ɛ nʲ i u̯ n ɐ"
          ],
          [
            "Євгеній",
            "j e u̯ ɦ ɛ nʲ i i̯"
          ],
          [
            "Євгенія",
            "j e u̯ ɦ ɛ nʲ i j ɐ"
          ],
          [
            "Євдокія",
            "j e u̯ d o kʲ i j ɐ"
          ],
          [
            "Євпаторія",
            "j e u̯ p ɐ t ɔ rʲ i j ɐ"
          ],
          [
            "Євразія",
            "j e u̯ r a zʲ i j ɐ"
          ],
          [
            "Євробачення",
            "j e u̯ r ɔ b a t͡ʃ e nʲː ɐ"
          ],
          [
            "Євромайдан",
            "j e u̯ r ɔ m ɐ i̯ d a n"
          ],
          [
            "Європа",
            "j e u̯ r ɔ p ɐ"
          ],
          [
            "Європи",
            "j e u̯ r ɔ p e"
          ],
          [
            "Європо",
            "j e u̯ r ɔ p ɔ"
          ],
          [
            "Європою",
            "j e u̯ r ɔ p ɔ j ʊ"
          ],
          [
            "Європу",
            "j e u̯ r ɔ p ʊ"
          ],
          [
            "Європі",
            "j e u̯ r ɔ pʲ i"
          ],
          [
            "Євросоюз",
            "j e u̯ r ɔ s ɔ j u z"
          ],
          [
            "Євсевій",
            "j e u̯ s ɛ ʋʲ i i̯"
          ],
          [
            "Євфрат",
            "j e u̯ f r a t"
          ],
          [
            "Єгипет",
            "j e ɦ ɪ p e t"
          ],
          [
            "Єгипте",
            "j e ɦ ɪ p t e"
          ],
          [
            "Єгиптові",
            "j e ɦ ɪ p t ɔ ʋʲ i"
          ],
          [
            "Єгиптом",
            "j e ɦ ɪ p t ɔ m"
          ],
          [
            "Єгипту",
            "j e ɦ ɪ p t ʊ"
          ],
          [
            "Єгипті",
            "j e ɦ ɪ p tʲ i"
          ],
          [
            "Єгор",
            "j e ɦ ɔ r"
          ],
          [
            "Єгорович",
            "j e ɦ ɔ r ɔ ʋ e t͡ʃ"
          ],
          [
            "Єгорів",
            "j e ɦ ɔ rʲ i u̯"
          ],
          [
            "Єгорівна",
            "j e ɦ ɔ rʲ i u̯ n ɐ"
          ],
          [
            "Єзуч",
            "j ɛ z ʊ t͡ʃ"
          ],
          [
            "Єлизавета",
            "j e ɫ e z ɐ ʋ ɛ t ɐ"
          ],
          [
            "Єлисаветград",
            "j e ɫ e s ɐ ʋ e d ɦ r a d"
          ],
          [
            "Єлисей",
            "j e ɫ e s ɛ i̯"
          ],
          [
            "Єллоунайф",
            "j e ɫː ɔ ʊ n a i̯ f"
          ],
          [
            "Єльський",
            "j ɛ lʲ sʲ k e i̯"
          ],
          [
            "Ємен",
            "j ɛ m e n"
          ],
          [
            "Єнакієв",
            "j e n a kʲ i j e u̯"
          ],
          [
            "Єнакієве",
            "j e n a kʲ i j e ʋ e"
          ],
          [
            "Єреван",
            "j e r e ʋ a n"
          ],
          [
            "Єременко",
            "j e r ɛ m e n k ɔ"
          ],
          [
            "Єрмак",
            "j e r m a k"
          ],
          [
            "Єрусалим",
            "j e r ʊ s ɐ ɫ ɪ m"
          ],
          [
            "Єфименко",
            "j e f ɪ m e n k ɔ"
          ],
          [
            "Єфінгар",
            "j e fʲ i n ɦ a r"
          ],
          [
            "Єґипет",
            "j e ɡ ɪ p e t"
          ]
        ],
        "url": "https://raw.githubusercontent.com/CUNY-CL/wikipron/master/data/scrape/tsv/ukr_cyrl_narrow.tsv"
      }
    }
  }
}
