{
  "id": "nb/grapheme-to-phoneme.data",
  "kind": "grapheme_to_phoneme",
  "source": "WIKIPRON",
  "derived_by": "dataset",
  "confidence": "high",
  "data": {
    "count": 3432,
    "byScript": {
      "nob_latn_broad": {
        "count": 3432,
        "sample": [
          [
            "A",
            "a"
          ],
          [
            "A",
            "ɑː"
          ],
          [
            "ABC",
            "ɑː b ɛ s eː"
          ],
          [
            "AD",
            "a nː ʊ d ʊ m iː n ɪ"
          ],
          [
            "AD",
            "ɑː d eː"
          ],
          [
            "Abessinia",
            "a b ə s iː n ɪ a"
          ],
          [
            "Abild",
            "ɑː b ɪ l"
          ],
          [
            "Abild",
            "ɑː b ɪ l d"
          ],
          [
            "Abkhasia",
            "a b k ɑː s ɪ a"
          ],
          [
            "Afghanistan",
            "ɑ f ɡ ɑ n ɪ s t ɑ n"
          ],
          [
            "Albania",
            "ɑ l b ɑ n j ɑ"
          ],
          [
            "Algerie",
            "ɑ l ʃ ə ɾ ɪː"
          ],
          [
            "Andorra",
            "a n d ɔ rː a"
          ],
          [
            "Angola",
            "ɑ ŋ ɡ u l ɑ"
          ],
          [
            "Arendal",
            "ɑː ɳ̩ d ɑː l"
          ],
          [
            "Arendal",
            "ɑː ʁ n̩ d ɑː l"
          ],
          [
            "Argentina",
            "ɑ ɾ ɡ ə n t ɪː n ɑ"
          ],
          [
            "Armenia",
            "ɑ ɾ m ɛː n j ɑ"
          ],
          [
            "Aruba",
            "ɑ ɾ ʉː b ɑ"
          ],
          [
            "Australia",
            "æ ʉ s t ɾ ɑː l j ɑ"
          ],
          [
            "B",
            "b"
          ],
          [
            "B",
            "b eː"
          ],
          [
            "Beijing",
            "b æ j d ʒ ɪ ŋ"
          ],
          [
            "Bergen",
            "b æ r ɡ ə n"
          ],
          [
            "Boadicea",
            "b uː d ɪ s eː a"
          ],
          [
            "Boudica",
            "b uː d ɪ k a"
          ],
          [
            "Boudicca",
            "b uː d ɪ kː a"
          ],
          [
            "Bouvetøya",
            "b u ʋ ɛ ø j ɑ"
          ],
          [
            "C",
            "k"
          ],
          [
            "C",
            "k a r b uː n"
          ],
          [
            "C",
            "k ʊ l ɔ m b"
          ],
          [
            "C",
            "s"
          ],
          [
            "C",
            "s eː"
          ],
          [
            "C",
            "s iː"
          ],
          [
            "C",
            "s ɛ l s ɪ ʉ s"
          ],
          [
            "C",
            "t ʃ"
          ],
          [
            "C",
            "ʃ"
          ],
          [
            "CD",
            "s eː d eː"
          ],
          [
            "Christiansand",
            "k r ɪ s t ɪ a n s a n"
          ],
          [
            "Christianssand",
            "k r ɪ s t ɪ a n s a n"
          ],
          [
            "Christianssund",
            "k r ɪ s t j a n s ʉ n"
          ],
          [
            "Copenhagen",
            "k o ʊ p ə n h e ɪ ɡ ə n"
          ],
          [
            "Cuba",
            "kʰ ʉ̀ː b ɑ"
          ],
          [
            "DD",
            "d eː d eː"
          ],
          [
            "DD",
            "d eː d ɑː ɡ"
          ],
          [
            "DD",
            "d eː d ɑː ɡ n̩"
          ],
          [
            "DD",
            "d uː n ɑ l d ʉ k"
          ],
          [
            "DD",
            "d ɑː t a m a ŋ ə l"
          ],
          [
            "DD",
            "d ɑː ɡ"
          ],
          [
            "DD",
            "d ɔ bː ə l d ɔ bː ə l"
          ]
        ],
        "url": "https://raw.githubusercontent.com/CUNY-CL/wikipron/master/data/scrape/tsv/nob_latn_broad.tsv"
      }
    }
  }
}
