{
  "id": "nl/word-class.data",
  "kind": "word_class",
  "source": "UD",
  "derived_by": "dataset",
  "confidence": "high",
  "data": {
    "uposCounts": {
      "PROPN": 660,
      "PUNCT": 1185,
      "NOUN": 2091,
      "CCONJ": 332,
      "AUX": 531,
      "ADP": 1463,
      "VERB": 1145,
      "DET": 1346,
      "NUM": 156,
      "ADJ": 762,
      "ADV": 608,
      "PRON": 451,
      "SCONJ": 191,
      "X": 68,
      "SYM": 63
    },
    "uposTags": [
      "ADJ",
      "ADP",
      "ADV",
      "AUX",
      "CCONJ",
      "DET",
      "NOUN",
      "NUM",
      "PRON",
      "PROPN",
      "PUNCT",
      "SCONJ",
      "SYM",
      "VERB",
      "X"
    ]
  }
}
