{
  "id": "de/orthography.data",
  "kind": "charset",
  "source": "CLDR",
  "derived_by": "dataset",
  "confidence": "high",
  "data": {
    "exemplarCharacters": "[aä b c d e f g h i j k l m n oö p q r s ß t uü v w x y z]",
    "auxiliary": "[áàăâåãā æ ç éèĕêëē ğ íìĭîïİī ı ñ óòŏôøō œ ş úùŭûū ÿ]",
    "punctuation": "[\\- ‐‑ – — , ; \\: ! ? . … '‘‚ \"“„ « » ( ) \\[ \\] \\{ \\} § @ * / \\& #]",
    "numbers": "[\\- ‑ , . % ‰ + − 0 1 2 3 4 5 6 7 8 9]",
    "index": "[A B C D E F G H I J K L M N O P Q R S T U V W X Y Z]"
  }
}
