{
  "id": "th/orthography.data",
  "kind": "charset",
  "source": "CLDR",
  "derived_by": "dataset",
  "confidence": "high",
  "data": {
    "exemplarCharacters": "[ฯๆ ๎ ์ ็ ่ ้ ๊ ๋ ก ข ฃ ค ฅ ฆ ง จ ฉ ช ซ ฌ ญ ฎ ฏ ฐ ฑ ฒ ณ ด ต ถ ท ธ น บ ป ผ ฝ พ ฟ ภ ม ย ร ฤ ล ฦ ว ศ ษ ส ห ฬ อ ฮ ํ ะ ั าๅ ำ ิ ี ึ ื ุ ู เ แ โ ใ ไ ฺ]",
    "auxiliary": "[\\u200B]",
    "punctuation": "[\\-‐‑–—,\\:!.…'‘’\"“”()\\[\\]@*/#′″]",
    "numbers": "[\\-‑,.%‰ + 0 1 2 3 4 5 6 7 8 9]",
    "index": "[ก ข ฃ ค ฅ ฆ ง จ ฉ ช ซ ฌ ญ ฎ ฏ ฐ ฑ ฒ ณ ด ต ถ ท ธ น บ ป ผ ฝ พ ฟ ภ ม ย ร ฤ ล ฦ ว ศ ษ ส ห ฬ อ ฮ]"
  }
}
