{
  "id": "fi/orthography.data",
  "kind": "charset",
  "source": "CLDR",
  "derived_by": "dataset",
  "confidence": "high",
  "data": {
    "exemplarCharacters": "[a b c d e f g h i j k l m n o p q r sš t u v w x y zž å ä ö]",
    "auxiliary": "[áàăâãąā ćčċç ďð đ éèêěëėęē ğǧģ ǥ ȟħ íîïİįī ı ǩķ ĺľļł ńňñņ ŋ óòôőõ œ ŕř śŝşș ß ťţț ŧ úùûůűųū ýÿü źż ʒǯ þ æ ø]",
    "punctuation": "[\\- ‐‑ – , ; \\: ! ? . … ’ ” » ( ) \\[ \\] § @ * / \\\\ \\& #]",
    "numbers": "[  , % ‰ + − 0 1 2 3 4 5 6 7 8 9]",
    "index": "[A B C D E F G H I J K L M N O P Q R S T U V W X Y Z Å Ä Ö]"
  }
}
