{
  "id": "hi/orthography.data",
  "kind": "charset",
  "source": "CLDR",
  "derived_by": "dataset",
  "confidence": "high",
  "data": {
    "exemplarCharacters": "[़ ॐ ं ँ ः अ आ इ ई उ ऊ ऋ ऌ ऍ ए ऐ ऑ ओ औ क ख ग घ ङ च छ ज झ ञ ट ठ ड ढ ण त थ द ध न प फ ब भ म य र ल ळ व श ष स ह ऽ ा ि ी ु ू ृ ॅ े ै ॉ ो ौ ्]",
    "auxiliary": "[\\u200C\\u200D ॄ]",
    "punctuation": "[\\- ‐‑ – — , ; \\: ! ? . … । ॥ '‘’ \"“” ( ) \\[ \\] § @ * / # † ‡ ′ ″ ॰]",
    "numbers": "[\\- ‑ , . % ‰ + 0० 1१ 2२ 3३ 4४ 5५ 6६ 7७ 8८ 9९]",
    "index": "[अ आ इ ई उ ऊ ऋ ए ऐ ओ औ क ख ग घ ङ च छ ज झ ञ ट ठ ड ढ ण त थ द ध न प फ ब भ म य र ल व श ष स ह]"
  }
}
