{
  "id": "bg/grapheme-to-phoneme.data",
  "kind": "grapheme_to_phoneme",
  "source": "WIKIPRON",
  "derived_by": "dataset",
  "confidence": "high",
  "data": {
    "count": 47572,
    "byScript": {
      "bul_cyrl_narrow": {
        "count": 47572,
        "sample": [
          [
            "'що",
            "ʃ t ɔ"
          ],
          [
            "'щото",
            "ʃ t ɔ t o"
          ],
          [
            "А",
            "a"
          ],
          [
            "АЕЦ",
            "a ɛ t͡s"
          ],
          [
            "Абаджиев",
            "ɐ b ɐ d ʒ i ɛ f"
          ],
          [
            "Абаджиева",
            "ɐ b ɐ d ʒ i ɛ v ɐ"
          ],
          [
            "Абаджийска",
            "ɐ b ɐ d ʒ i j s k ɐ"
          ],
          [
            "Абаджийски",
            "ɐ b ɐ d ʒ i j s k i"
          ],
          [
            "Абакан",
            "ɐ b ɐ k a n"
          ],
          [
            "Абиджан",
            "ɐ b i d ʒ a̟ n"
          ],
          [
            "Абисиния",
            "ɐ b i s i n i j ɐ"
          ],
          [
            "Абланица",
            "a b ɫ ɐ n i t͡s ɐ"
          ],
          [
            "Абрашев",
            "ɐ b r a ʃ ɛ f"
          ],
          [
            "Абрашева",
            "ɐ b r a ʃ ɛ v ɐ"
          ],
          [
            "Абрит",
            "ɐ b r i t"
          ],
          [
            "Абхазия",
            "ɐ p x a z i j ɐ"
          ],
          [
            "Авакум",
            "ɐ v ɐ k u m"
          ],
          [
            "Авджиев",
            "ɐ v d ʒ i ɛ f"
          ],
          [
            "Авджийски",
            "ɐ v d ʒ i j s k i"
          ],
          [
            "Авджиски",
            "ɐ v d ʒ i s k i"
          ],
          [
            "Аврамов",
            "ɐ v r a m o f"
          ],
          [
            "Аврамово",
            "ɐ v r a m o v o"
          ],
          [
            "Аврен",
            "a v r ɛ n"
          ],
          [
            "Австралия",
            "ɐ f s t r a l i j ɐ"
          ],
          [
            "Австрия",
            "a f s t r i j ɐ"
          ],
          [
            "Агаев",
            "ɐ ɡ a ɛ f"
          ],
          [
            "Агаин",
            "ɐ ɡ a i n"
          ],
          [
            "Агатово",
            "ɐ ɡ a t o v o"
          ],
          [
            "Агура",
            "ɐ ɡ u r ɐ"
          ],
          [
            "Адалиев",
            "ɐ d ɐ l i ɛ f"
          ],
          [
            "Адам",
            "a d ɐ m"
          ],
          [
            "Адам",
            "ɐ d a m"
          ],
          [
            "Адамс",
            "a d ɐ m s"
          ],
          [
            "Адилов",
            "ɐ d i ɫ o f"
          ],
          [
            "Аерофлот",
            "ɐ ɛ r o f ɫ ɔ t"
          ],
          [
            "Азербайджан",
            "ɐ z ɛ r b ɐ j d ʒ a̟ n"
          ],
          [
            "Азия",
            "a z i j ɐ"
          ],
          [
            "Азманите",
            "ɐ z m a n i t ɛ"
          ],
          [
            "Айдаров",
            "ɐ j d a r o f"
          ],
          [
            "Айдемир",
            "ɐ j d ɛ m i r"
          ],
          [
            "Айджиев",
            "ɐ j d ʒ i ɛ f"
          ],
          [
            "Айдинов",
            "ɐ j d i n o f"
          ],
          [
            "Айнаджиев",
            "ɐ j n ɐ d ʒ i ɛ f"
          ],
          [
            "Айналийски",
            "ɐ j n ɐ l i j s k i"
          ],
          [
            "Айрин",
            "ɐ j r i n"
          ],
          [
            "Айрис",
            "a j r i s"
          ],
          [
            "Айрово",
            "a j r o v o"
          ],
          [
            "Айтос",
            "a j t o s"
          ],
          [
            "Аканджиев",
            "ɐ k ɐ n d ʒ i ɛ f"
          ],
          [
            "Аканджиево",
            "ɐ k ɐ n d ʒ i ɛ v o"
          ]
        ],
        "url": "https://raw.githubusercontent.com/CUNY-CL/wikipron/master/data/scrape/tsv/bul_cyrl_narrow.tsv"
      }
    }
  }
}
