{
  "id": "th/word-class.data",
  "kind": "word_class",
  "source": "UD",
  "derived_by": "dataset",
  "confidence": "high",
  "data": {
    "uposCounts": {
      "PUNCT": 274,
      "ADP": 3135,
      "VERB": 4654,
      "PART": 608,
      "NOUN": 6054,
      "ADJ": 968,
      "AUX": 1159,
      "DET": 1027,
      "ADV": 952,
      "PROPN": 1490,
      "CCONJ": 606,
      "PRON": 684,
      "NUM": 581,
      "SYM": 132,
      "SCONJ": 2,
      "X": 4
    },
    "uposTags": [
      "ADJ",
      "ADP",
      "ADV",
      "AUX",
      "CCONJ",
      "DET",
      "NOUN",
      "NUM",
      "PART",
      "PRON",
      "PROPN",
      "PUNCT",
      "SCONJ",
      "SYM",
      "VERB",
      "X"
    ]
  }
}
