{
  "id": "sv/orthography.data",
  "kind": "charset",
  "source": "CLDR",
  "derived_by": "dataset",
  "confidence": "high",
  "data": {
    "exemplarCharacters": "[aГ  b c d eГ© f g h i j k l m n o p q r s t u v w x y z ГҘ ГӨ Г¶]",
    "auxiliary": "[ГЎГўГЈДҒ Г§ ГЁГ« ГӯГ®ГҜД« Гұ Гі Гә ГҝГј ГҰ Гё]",
    "punctuation": "[\\- вҖҗвҖ‘ вҖ“ вҖ” , ; \\: ! ? . вҖҰ 'вҖҳвҖҷ \"вҖңвҖқ ( ) \\[ \\] В§ @ * / \\& # вҖ  вҖЎ вҖІ вҖі]",
    "numbers": "[В  , % вҖ° + вҲ’ 0 1 2 3 4 5 6 7 8 9]",
    "index": "[A B C D E F G H I J K L M N O P Q R S T U V W X Y Z Г… Г„ Г–]"
  }
}
