{
  "id": "zh/grapheme-to-phoneme.data",
  "kind": "grapheme_to_phoneme",
  "source": "WIKIPRON",
  "derived_by": "dataset",
  "confidence": "high",
  "data": {
    "count": 168655,
    "byScript": {
      "cmn_hani_standard_broad": {
        "count": 168655,
        "sample": [
          [
            "㐁",
            "tʰ i̯ ɛ n ⁵ ¹"
          ],
          [
            "㐆",
            "i n ² ¹ ⁴"
          ],
          [
            "㐌",
            "i ³ ⁵"
          ],
          [
            "㐖",
            "ɕ i̯ ɛ ³ ⁵"
          ],
          [
            "㐖毒",
            "ɕ i̯ ɛ ³ ⁵ t u ³ ⁵"
          ],
          [
            "㐨",
            "ɕ y ⁵ ¹"
          ],
          [
            "㐩",
            "ɕ i ŋ ³ ⁵"
          ],
          [
            "㐭",
            "l i n ² ¹ ⁴"
          ],
          [
            "㐱",
            "l i ŋ ² ¹ ⁴"
          ],
          [
            "㐱",
            "l i ŋ ³ ⁵"
          ],
          [
            "㐱",
            "l i ŋ ⁵ ¹"
          ],
          [
            "㐱",
            "l i̯ ɛ n ³ ⁵"
          ],
          [
            "㐲",
            "t a ɪ̯ ⁵ ¹"
          ],
          [
            "㐸",
            "t͡sʰ z̩ ⁵ ¹"
          ],
          [
            "㐻",
            "n e ɪ̯ ⁵ ¹"
          ],
          [
            "㑁",
            "ʈ͡ʂ u̯ ɔ ⁵ ⁵"
          ],
          [
            "㑉",
            "s u ⁵ ¹"
          ],
          [
            "㑊",
            "i ⁵ ¹"
          ],
          [
            "㑋",
            "t͡ɕʰ i̯ ʊ ŋ ⁵ ¹"
          ],
          [
            "㑌",
            "kʰ u̯ ɑ ŋ ⁵ ⁵"
          ],
          [
            "㑍",
            "l e ɪ̯ ² ¹ ⁴"
          ],
          [
            "㑎",
            "n ɑ ʊ̯ ² ¹ ⁴"
          ],
          [
            "㑐",
            "ʂ u ⁵ ⁵"
          ],
          [
            "㑓",
            "t͡ɕ y n ⁵ ¹"
          ],
          [
            "㑗",
            "ʂ ə n ⁵ ⁵"
          ],
          [
            "㑙",
            "j ʊ ŋ ² ¹ ⁴"
          ],
          [
            "㑙",
            "t i̯ ɛ ³ ⁵"
          ],
          [
            "㑚",
            "n u̯ ɔ ³ ⁵"
          ],
          [
            "㑛",
            "s u ⁵ ¹"
          ],
          [
            "㑜",
            "i ⁵ ¹"
          ],
          [
            "㑝",
            "l ʊ ŋ ⁵ ¹"
          ],
          [
            "㑟",
            "p ɤ ŋ ² ¹ ⁴"
          ],
          [
            "㑣",
            "l ä n ³ ⁵"
          ],
          [
            "㑥",
            "i ⁵ ¹"
          ],
          [
            "㑦",
            "l i ⁵ ¹"
          ],
          [
            "㑧",
            "t͡ɕ i ⁵ ¹"
          ],
          [
            "㑮",
            "x u̯ ə n ³ ⁵"
          ],
          [
            "㑯",
            "ɕ y ² ¹ ⁴"
          ],
          [
            "㑰",
            "x u̯ e ɪ̯ ⁵ ¹"
          ],
          [
            "㑱",
            "ʐ ɑ ʊ̯ ² ¹ ⁴"
          ],
          [
            "㑳",
            "ʈ͡ʂ o ʊ̯ ⁵ ¹"
          ],
          [
            "㑳",
            "ʈ͡ʂ u ⁵ ⁵"
          ],
          [
            "㑵",
            "x ä n ⁵ ¹"
          ],
          [
            "㑶",
            "ɕ i ⁵ ¹"
          ],
          [
            "㑸",
            "j ɑ ʊ̯ ³ ⁵"
          ],
          [
            "㑻",
            "m ä ⁵ ¹"
          ],
          [
            "㑼",
            "l y̯ ɛ ⁵ ¹"
          ],
          [
            "㑾",
            "j ɑ ʊ̯ ³ ⁵"
          ],
          [
            "㑾",
            "ɕ i̯ ɑ ʊ̯ ³ ⁵"
          ],
          [
            "㑿",
            "ʈ͡ʂ ɑ ʊ̯ ⁵ ¹"
          ]
        ],
        "url": "https://raw.githubusercontent.com/CUNY-CL/wikipron/master/data/scrape/tsv/cmn_hani_standard_broad.tsv"
      }
    }
  }
}
